
Cementerios de Madrid;sociedad-bienestar;cementerios, www.madrid.es;15/04/2014;;;;continua;Dirección General de Atención a la Ciudadanía;Ayuntamiento de Madrid;https://datos.madrid.es/egob/catalogo/aviso-legal;Madrid,;csv,json,api,rdf,geo,xml,;45220;https://datos.madrid.es/portal/site/egob/menuitem.c05c1f754a33a9fbe4b2e4b284f1a5a0/?vgnextoid=bec8611e09fd4410VgnVCM1000000b205a0aRCRD&vgnextchannel=374512b9ace9f310VgnVCM100000171f5a0aRCRD&vgnextfmt=default
Censo de animales domésticos por distrito;salud;animales,perros,gatos,censo,mascotas;18/06/2014;24/04/2024;01/01/2014;31/12/2023;anual;Madrid Salud;Ayuntamiento de Madrid;https://datos.madrid.es/egob/catalogo/aviso-legal;Madrid,;csv,xls,;28221;https://datos.madrid.es/portal/site/egob/menuitem.c05c1f754a33a9fbe4b2e4b284f1a5a0/?vgnextoid=3e573d68ae8a6410VgnVCM1000000b205a0aRCRD&vgnextchannel=374512b9ace9f310VgnVCM100000171f5a0aRCRD&vgnextfmt=default
Censo de locales, sus actividades y terrazas de hostelería y restauración;comercio;negocio tienda establecimiento;12/03/2014;31/12/2024;;;diaria;Dirección General de Contratación y Servicios - Subdirección General de Estadística;Ayuntamiento de Madrid;https://datos.madrid.es/egob/catalogo/aviso-legal;Madrid,;csv,json,xml,;83565;https://datos.madrid.es/portal/site/egob/menuitem.c05c1f754a33a9fbe4b2e4b284f1a5a0/?vgnextoid=66665cde99be2410VgnVCM1000000b205a0aRCRD&vgnextchannel=374512b9ace9f310VgnVCM100000171f5a0aRCRD&vgnextfmt=default
Censo de locales, sus actividades y terrazas de hostelería y restauración. Histórico;comercio;negocio tienda establecimiento local, actividad económica,;22/10/2014;17/12/2024;;;diaria;Dirección General de Contratación y Servicios - Subdirección General de Estadística;Ayuntamiento de Madrid;https://datos.madrid.es/egob/catalogo/aviso-legal;Madrid,;csv,json,api,xml,;540648;https://datos.madrid.es/portal/site/egob/menuitem.c05c1f754a33a9fbe4b2e4b284f1a5a0/?vgnextoid=23160329ff639410VgnVCM2000000c205a0aRCRD&vgnextchannel=374512b9ace9f310VgnVCM100000171f5a0aRCRD&vgnextfmt=default
Centros Culturales Municipales (incluyen Socioculturales y Juveniles);cultura-ocio;cultura, equipamientos, www.madrid.es;12/03/2014;;;;continua;Dirección General de Atención a la Ciudadanía;Ayuntamiento de Madrid;https://datos.madrid.es/egob/catalogo/aviso-legal;Madrid,;csv,json,api,rdf,geo,xml,;78206;https://datos.madrid.es/portal/site/egob/menuitem.c05c1f754a33a9fbe4b2e4b284f1a5a0/?vgnextoid=fc8a034270603410VgnVCM1000000b205a0aRCRD&vgnextchannel=374512b9ace9f310VgnVCM100000171f5a0aRCRD&vgnextfmt=default
Centros de acogida de la Red Municipal de Atención a Personas Sin Hogar;sociedad-bienestar;personas sin hogar, centros de acogida, sin hogar, atención a personas sin hogar;15/04/2014;;;;continua;Dirección General de Inclusión Social y Cooperación al Desarrollo;Ayuntamiento de Madrid;https://datos.madrid.es/egob/catalogo/aviso-legal;Madrid,;csv,json,api,rdf,geo,xml,;18295;https://datos.madrid.es/portal/site/egob/menuitem.c05c1f754a33a9fbe4b2e4b284f1a5a0/?vgnextoid=5eaaa516f8045410VgnVCM1000000b205a0aRCRD&vgnextchannel=374512b9ace9f310VgnVCM100000171f5a0aRCRD&vgnextfmt=default
Centros de Atención para Menores y Familia;sociedad-bienestar;menores, infancia, familia, jovenes, adolescentes, www.madrid.es;15/04/2014;;;;continua;Dirección General de Familia e Infancia;Ayuntamiento de Madrid;https://datos.madrid.es/egob/catalogo/aviso-legal;Madrid,;csv,json,api,rdf,geo,xml,;24025;https://datos.madrid.es/portal/site/egob/menuitem.c05c1f754a33a9fbe4b2e4b284f1a5a0/?vgnextoid=1ee5793579ef4410VgnVCM2000000c205a0aRCRD&vgnextchannel=374512b9ace9f310VgnVCM100000171f5a0aRCRD&vgnextfmt=default
Centros de la Escuela Oficial de Idiomas en Madrid;educacion;centros idiomas, inglés, francés, árabe, alemán, chino, Escuela oficial de Idiomas, www.madrid.es;30/06/2014;;;;continua;Dirección General de Atención a la Ciudadanía;Ayuntamiento de Madrid;https://datos.madrid.es/egob/catalogo/aviso-legal;Madrid,;csv,json,api,rdf,geo,xml,;21889;https://datos.madrid.es/portal/site/egob/menuitem.c05c1f754a33a9fbe4b2e4b284f1a5a0/?vgnextoid=1e289ae300096410VgnVCM1000000b205a0aRCRD&vgnextchannel=374512b9ace9f310VgnVCM100000171f5a0aRCRD&vgnextfmt=default
Centros de Servicios Sociales Municipales;sociedad-bienestar;servicios sociales, centros de servicios sociales, dependencia residencias RMI, www.madrid.es;06/10/2014;;;;continua;Dirección General de Servicios Sociales y Atención a la Discapacidad;Ayuntamiento de Madrid;https://datos.madrid.es/egob/catalogo/aviso-legal;Madrid,;csv,json,api,rdf,geo,xml,;27912;https://datos.madrid.es/portal/site/egob/menuitem.c05c1f754a33a9fbe4b2e4b284f1a5a0/?vgnextoid=7c123e08dafc8410VgnVCM1000000b205a0aRCRD&vgnextchannel=374512b9ace9f310VgnVCM100000171f5a0aRCRD&vgnextfmt=default
Centros educativos en Madrid;educacion;centros educativos;17/02/2023;;;;continua;Dirección General de Atención a la Ciudadanía;Ayuntamiento de Madrid;https://datos.madrid.es/egob/catalogo/aviso-legal;Madrid,;csv,json,api,rdf,geo,xml,;38853;https://datos.madrid.es/portal/site/egob/menuitem.c05c1f754a33a9fbe4b2e4b284f1a5a0/?vgnextoid=f14878a6d4556810VgnVCM1000001d4a900aRCRD&vgnextchannel=374512b9ace9f310VgnVCM100000171f5a0aRCRD&vgnextfmt=default
Centros Municipales de Mayores;sociedad-bienestar;mayores, equipamientos, www.madrid.es;12/03/2014;;;;continua;Dirección General de Mayores y Prevención de la Soledad No Deseada;Ayuntamiento de Madrid;https://datos.madrid.es/egob/catalogo/aviso-legal;Madrid,;csv,json,api,rdf,geo,xml,;83356;https://datos.madrid.es/portal/site/egob/menuitem.c05c1f754a33a9fbe4b2e4b284f1a5a0/?vgnextoid=86e9eca8a5a03410VgnVCM1000000b205a0aRCRD&vgnextchannel=374512b9ace9f310VgnVCM100000171f5a0aRCRD&vgnextfmt=default
Centros municipales de mayores. Datos sobre número y perfil de socios y socias;sociedad-bienestar;Centros Municipales de Mayores, envejecimiento activo, servicios sociales, bienestar social, tarjeta madridmayor.es;19/07/2017;14/02/2025;01/01/2017;31/01/2025;mensual;Dirección General de Mayores y Prevención de la Soledad No Deseada;Ayuntamiento de Madrid;https://datos.madrid.es/egob/catalogo/aviso-legal;Madrid,;xls,;9370;https://datos.madrid.es/portal/site/egob/menuitem.c05c1f754a33a9fbe4b2e4b284f1a5a0/?vgnextoid=c9161cf402a5d510VgnVCM2000001f4a900aRCRD&vgnextchannel=374512b9ace9f310VgnVCM100000171f5a0aRCRD&vgnextfmt=default
Centros para personas con discapacidad;sociedad-bienestar;discapacidad, intelectual, ocupacional, discapacidad física, www.madrid.es;15/04/2014;;;;continua;Dirección General de Atención a la Ciudadanía;Ayuntamiento de Madrid;https://datos.madrid.es/egob/catalogo/aviso-legal;Madrid,;csv,json,api,rdf,geo,xml,;21025;https://datos.madrid.es/portal/site/egob/menuitem.c05c1f754a33a9fbe4b2e4b284f1a5a0/?vgnextoid=bd2b7f0e53045410VgnVCM2000000c205a0aRCRD&vgnextchannel=374512b9ace9f310VgnVCM100000171f5a0aRCRD&vgnextfmt=default
Citas proporcionadas desde los Centros de Servicios Sociales del Ayuntamiento de Madrid;sociedad-bienestar;servicios,sociales,citas;29/03/2019;09/01/2025;01/01/2018;31/12/2024;trimestral;Dirección General de Servicios Sociales y Atención a la Discapacidad;Ayuntamiento de Madrid;https://datos.madrid.es/egob/catalogo/aviso-legal;Madrid,;csv,xls,;8294;https://datos.madrid.es/portal/site/egob/menuitem.c05c1f754a33a9fbe4b2e4b284f1a5a0/?vgnextoid=73ee23d869578610VgnVCM2000001f4a900aRCRD&vgnextchannel=374512b9ace9f310VgnVCM100000171f5a0aRCRD&vgnextfmt=default
Colectivos ciudadanos (Sección 3ª);sociedad-bienestar;asociaciones, federaciones, colectivos, fundaciones, participación, entidades de participación;10/06/2020;19/02/2025;;;diaria;Dirección General de Participación Ciudadana;Ayuntamiento de Madrid;https://datos.madrid.es/egob/catalogo/aviso-legal;Madrid,;csv,xls,;3506;https://datos.madrid.es/portal/site/egob/menuitem.c05c1f754a33a9fbe4b2e4b284f1a5a0/?vgnextoid=983de3811af52710VgnVCM1000001d4a900aRCRD&vgnextchannel=374512b9ace9f310VgnVCM100000171f5a0aRCRD&vgnextfmt=default
Colegios Públicos de Madrid;educacion;educación, colegios, ceip, primaria, infantil, www.madrid.es;12/03/2014;;;;continua;Dirección General de Atención a la Ciudadanía;Ayuntamiento de Madrid;https://datos.madrid.es/egob/catalogo/aviso-legal;Madrid,;csv,json,api,rdf,geo,xml,;147774;https://datos.madrid.es/portal/site/egob/menuitem.c05c1f754a33a9fbe4b2e4b284f1a5a0/?vgnextoid=78da52c974fb3410VgnVCM2000000c205a0aRCRD&vgnextchannel=374512b9ace9f310VgnVCM100000171f5a0aRCRD&vgnextfmt=default
Comisarias;seguridad;Comisaria, www.madrid.es;22/11/2022;;;;continua;Dirección General de Atención a la Ciudadanía;Ayuntamiento de Madrid;https://datos.madrid.es/egob/catalogo/aviso-legal;Madrid,;csv,json,api,rdf,geo,xml,;5107;https://datos.madrid.es/portal/site/egob/menuitem.c05c1f754a33a9fbe4b2e4b284f1a5a0/?vgnextoid=6daf6689abe94810VgnVCM1000001d4a900aRCRD&vgnextchannel=374512b9ace9f310VgnVCM100000171f5a0aRCRD&vgnextfmt=default
Concejales del Ayuntamiento de Madrid desde 1979;sector-publico;concejales,historico,1979;13/02/2018;04/10/2024;;01/10/2024;sindefinir;Secretaría General del Pleno;Ayuntamiento de Madrid;https://datos.madrid.es/egob/catalogo/aviso-legal;Madrid,;csv,xls,;3364;https://datos.madrid.es/portal/site/egob/menuitem.c05c1f754a33a9fbe4b2e4b284f1a5a0/?vgnextoid=0ee64fc858ae0610VgnVCM1000001d4a900aRCRD&vgnextchannel=374512b9ace9f310VgnVCM100000171f5a0aRCRD&vgnextfmt=default
Concesiones de quioscos;comercio;concesiones, quioscos;11/03/2019;12/06/2024;01/01/2018;31/12/2023;anual;Dirección General de Coordinación Territorial y Desconcentración;Ayuntamiento de Madrid;https://datos.madrid.es/egob/catalogo/aviso-legal;Madrid,;csv,xls,geo,;8760;https://datos.madrid.es/portal/site/egob/menuitem.c05c1f754a33a9fbe4b2e4b284f1a5a0/?vgnextoid=55ba0ecd69d49610VgnVCM2000001f4a900aRCRD&vgnextchannel=374512b9ace9f310VgnVCM100000171f5a0aRCRD&vgnextfmt=default
Consumo de energía en edificios municipales. Datos mensuales;energia;energía, edificios municipales, consumo, kWh, gas, electricidad, m3/h, kVAr;16/04/2020;05/02/2025;01/03/2020;31/01/2025;mensual;Dirección General de Sostenibilidad y Control Ambiental;Ayuntamiento de Madrid;https://datos.madrid.es/egob/catalogo/aviso-legal;Madrid,;csv,xls,;4662;https://datos.madrid.es/portal/site/egob/menuitem.c05c1f754a33a9fbe4b2e4b284f1a5a0/?vgnextoid=d6fe4f894ef31710VgnVCM1000001d4a900aRCRD&vgnextchannel=374512b9ace9f310VgnVCM100000171f5a0aRCRD&vgnextfmt=default
Contaminación acústica. Datos diarios (acumulado);medio-ambiente;contaminación acústica , ruido , TranspaMedioAmbiente;02/07/2015;;;;diaria;Dirección General de Sostenibilidad y Control Ambiental;Ayuntamiento de Madrid;https://datos.madrid.es/egob/catalogo/aviso-legal;Madrid,;csv,txt,;143383;https://datos.madrid.es/portal/site/egob/menuitem.c05c1f754a33a9fbe4b2e4b284f1a5a0/?vgnextoid=b8c427a272e4e410VgnVCM2000000c205a0aRCRD&vgnextchannel=374512b9ace9f310VgnVCM100000171f5a0aRCRD&vgnextfmt=default
Contaminación acústica. Datos históricos mensuales;medio-ambiente;contaminación acústica , ruido , TranspaMedioAmbiente;09/04/2015;05/02/2025;01/01/1998;31/01/2025;mensual;Dirección General de Sostenibilidad y Control Ambiental;Ayuntamiento de Madrid;https://datos.madrid.es/egob/catalogo/aviso-legal;Madrid,;csv,xls,;271;https://datos.madrid.es/portal/site/egob/menuitem.c05c1f754a33a9fbe4b2e4b284f1a5a0/?vgnextoid=2ec892874870b410VgnVCM1000000b205a0aRCRD&vgnextchannel=374512b9ace9f310VgnVCM100000171f5a0aRCRD&vgnextfmt=default
Contaminación acústica: Estaciones de medida;medio-ambiente;contaminación acústica , estaciones , ruido , TranspaMedioAmbiente;09/04/2015;20/04/2023;;20/04/2023;sindefinir;Dirección General de Sostenibilidad y Control Ambiental;Ayuntamiento de Madrid;https://datos.madrid.es/egob/catalogo/aviso-legal;Madrid,;csv,xls,shp,geo,;8545;https://datos.madrid.es/portal/site/egob/menuitem.c05c1f754a33a9fbe4b2e4b284f1a5a0/?vgnextoid=b05a79ea1770b410VgnVCM1000000b205a0aRCRD&vgnextchannel=374512b9ace9f310VgnVCM100000171f5a0aRCRD&vgnextfmt=default
Contenedores de aceite vegetal usado;medio-ambiente;Contenedor,aceite,vegetal,usado,;28/02/2018;14/11/2024;;30/09/2024;trimestral;Dirección General de Servicios de Limpieza y Residuos;Ayuntamiento de Madrid;https://datos.madrid.es/egob/catalogo/aviso-legal;Madrid,;csv,xls,;96451;https://datos.madrid.es/portal/site/egob/menuitem.c05c1f754a33a9fbe4b2e4b284f1a5a0/?vgnextoid=11a0c4d8d2cd1610VgnVCM2000001f4a900aRCRD&vgnextchannel=374512b9ace9f310VgnVCM100000171f5a0aRCRD&vgnextfmt=default
Contenedores de papel-cartón, vidrio, envases, orgánica y restos;medio-ambiente;Contenedor,aceite,vegetal,usado,;26/10/2018;06/05/2024;;06/05/2024;anual;Dirección General de Servicios de Limpieza y Residuos;Ayuntamiento de Madrid;https://datos.madrid.es/egob/catalogo/aviso-legal;Madrid,;csv,xls,;75532;https://datos.madrid.es/portal/site/egob/menuitem.c05c1f754a33a9fbe4b2e4b284f1a5a0/?vgnextoid=38ed95bac1ba6610VgnVCM1000001d4a900aRCRD&vgnextchannel=374512b9ace9f310VgnVCM100000171f5a0aRCRD&vgnextfmt=default
Contenedores de pilas en marquesinas de autobús;medio-ambiente;pilas reciclaje contenedores marquesinas;04/11/2014;13/11/2024;;29/10/2023;anual;Empresa Municipal de Transportes, S.A.;Ayuntamiento de Madrid;https://datos.madrid.es/egob/catalogo/aviso-legal;Madrid,;csv,xls,;18476;https://datos.madrid.es/portal/site/egob/menuitem.c05c1f754a33a9fbe4b2e4b284f1a5a0/?vgnextoid=b2232d854a879410VgnVCM1000000b205a0aRCRD&vgnextchannel=374512b9ace9f310VgnVCM100000171f5a0aRCRD&vgnextfmt=default
Contenedores de ropa autorizados del Ayuntamiento de Madrid;medio-ambiente;Contenedor,ropa,usada,dependencia;12/03/2014;14/10/2024;;30/09/2024;trimestral;Dirección General de Servicios de Limpieza y Residuos;Ayuntamiento de Madrid;https://datos.madrid.es/egob/catalogo/aviso-legal;Madrid,;csv,xls,;335884;https://datos.madrid.es/portal/site/egob/menuitem.c05c1f754a33a9fbe4b2e4b284f1a5a0/?vgnextoid=38e9a94f27294410VgnVCM2000000c205a0aRCRD&vgnextchannel=374512b9ace9f310VgnVCM100000171f5a0aRCRD&vgnextfmt=default
Contenedores o sacos de residuos de construcción y demolición (RCD) llenos más de 24 horas;medio-ambiente;Contenedor, saco, RCD, R.C.D., residuos, residuo, construcción, demolición ;14/03/2017;;;;diaria;Dirección General de Servicios de Limpieza y Residuos;Ayuntamiento de Madrid;https://datos.madrid.es/egob/catalogo/aviso-legal;Madrid,;xls,;3874;https://datos.madrid.es/portal/site/egob/menuitem.c05c1f754a33a9fbe4b2e4b284f1a5a0/?vgnextoid=735d05a1167ca510VgnVCM2000001f4a900aRCRD&vgnextchannel=374512b9ace9f310VgnVCM100000171f5a0aRCRD&vgnextfmt=default
Contratos de arrendamiento;sector-publico;contratos arrendamiento , alquileres;17/07/2019;;;31/10/2024;trimestral;Dirección General de Gestión del Patrimonio;Ayuntamiento de Madrid;https://datos.madrid.es/egob/catalogo/aviso-legal;Madrid,;xls,;1172;https://datos.madrid.es/portal/site/egob/menuitem.c05c1f754a33a9fbe4b2e4b284f1a5a0/?vgnextoid=dc651a3be9ffb610VgnVCM1000001d4a900aRCRD&vgnextchannel=374512b9ace9f310VgnVCM100000171f5a0aRCRD&vgnextfmt=default
Convenios;sector-publico;convenios;11/12/2018;12/02/2025;;31/01/2025;mensual;Oficina de la Secretaría de la Junta de Gobierno;Ayuntamiento de Madrid;https://datos.madrid.es/egob/catalogo/aviso-legal;Madrid,;xls,;14591;https://datos.madrid.es/portal/site/egob/menuitem.c05c1f754a33a9fbe4b2e4b284f1a5a0/?vgnextoid=df55f4c203d97610VgnVCM2000001f4a900aRCRD&vgnextchannel=374512b9ace9f310VgnVCM100000171f5a0aRCRD&vgnextfmt=default
COVID-19. Histórico de datos del tráfico (datos semanales);transporte;movilidad transporte circulación , TranspaTrafico , TranspaMovilidad;23/04/2020;10/08/2020;30/03/2020;09/08/2020;informacionhistorica;Dirección General de Gestión y Vigilancia de la Circulación;Ayuntamiento de Madrid;https://datos.madrid.es/egob/catalogo/aviso-legal;Madrid,;csv,zip,;13564;https://datos.madrid.es/portal/site/egob/menuitem.c05c1f754a33a9fbe4b2e4b284f1a5a0/?vgnextoid=e51f1016356a1710VgnVCM1000001d4a900aRCRD&vgnextchannel=374512b9ace9f310VgnVCM100000171f5a0aRCRD&vgnextfmt=default
Datos meteorológicos. Datos diarios desde 2019;medio-ambiente;meteorológicos, estaciones, lluvia, viento, presión barométrica, radiación solar, humedad, diarios;10/06/2019;06/02/2025;01/01/2019;31/01/2025;mensual;Dirección General de Sostenibilidad y Control Ambiental;Ayuntamiento de Madrid;https://datos.madrid.es/egob/catalogo/aviso-legal;Madrid,;csv,txt,xml,;35297;https://datos.madrid.es/portal/site/egob/menuitem.c05c1f754a33a9fbe4b2e4b284f1a5a0/?vgnextoid=8d7357cec5efa610VgnVCM1000001d4a900aRCRD&vgnextchannel=374512b9ace9f310VgnVCM100000171f5a0aRCRD&vgnextfmt=default
Datos meteorológicos. Datos en tiempo real;medio-ambiente;Salud Pública, Medio Ambiente, ,Impacto ambiental, Salud Contaminación polución, TranspaMedioAmbiente;15/10/2019;;;;tiemporeal;Dirección General de Sostenibilidad y Control Ambiental;Ayuntamiento de Madrid;https://datos.madrid.es/egob/catalogo/aviso-legal;Madrid,;csv,txt,xml,;1198821;https://datos.madrid.es/portal/site/egob/menuitem.c05c1f754a33a9fbe4b2e4b284f1a5a0/?vgnextoid=4985724ec1acd610VgnVCM1000001d4a900aRCRD&vgnextchannel=374512b9ace9f310VgnVCM100000171f5a0aRCRD&vgnextfmt=default
Datos meteorológicos. Datos horarios desde 2019;medio-ambiente;meteorológicos, estaciones, lluvia, viento, presión barométrica, radiación solar, humedad, horarios;10/06/2019;06/02/2025;01/01/2019;31/01/2025;mensual;Dirección General de Sostenibilidad y Control Ambiental;Ayuntamiento de Madrid;https://datos.madrid.es/egob/catalogo/aviso-legal;Madrid,;csv,txt,xml,;213412;https://datos.madrid.es/portal/site/egob/menuitem.c05c1f754a33a9fbe4b2e4b284f1a5a0/?vgnextoid=fa8357cec5efa610VgnVCM1000001d4a900aRCRD&vgnextchannel=374512b9ace9f310VgnVCM100000171f5a0aRCRD&vgnextfmt=default
Datos meteorológicos. Estaciones de control;medio-ambiente;meteorológicos, estaciones, lluvia, viento, presión barométrica, radiación solar, humedad;10/06/2019;12/12/2024;;10/12/2024;anual;Dirección General de Sostenibilidad y Control Ambiental;Ayuntamiento de Madrid;https://datos.madrid.es/egob/catalogo/aviso-legal;Madrid,;csv,xls,geo,;857792;https://datos.madrid.es/portal/site/egob/menuitem.c05c1f754a33a9fbe4b2e4b284f1a5a0/?vgnextoid=2ac5be53b4d2b610VgnVCM2000001f4a900aRCRD&vgnextchannel=374512b9ace9f310VgnVCM100000171f5a0aRCRD&vgnextfmt=default
Declaración de bienes y actividades de los concejales del Ayuntamiento de Madrid. Corporación 2019-2023;sector-publico;bienes y actividades, concejales, declaración de bienes y actividades;24/07/2019;;;;sindefinir;Secretaría General del Pleno;Ayuntamiento de Madrid;https://datos.madrid.es/egob/catalogo/aviso-legal;Madrid,;xls,;4244;https://datos.madrid.es/portal/site/egob/menuitem.c05c1f754a33a9fbe4b2e4b284f1a5a0/?vgnextoid=a6483a2fdbe1c610VgnVCM2000001f4a900aRCRD&vgnextchannel=374512b9ace9f310VgnVCM100000171f5a0aRCRD&vgnextfmt=default
Denuncias y sanciones sobre limpieza urbana y zonas verdes;medio-ambiente;Sanción,Legalidad;07/08/2017;21/01/2025;;31/12/2024;trimestral;Dirección General de Servicios de Limpieza y Residuos;Ayuntamiento de Madrid;https://datos.madrid.es/egob/catalogo/aviso-legal;Madrid,;csv,xls,;21105;https://datos.madrid.es/portal/site/egob/menuitem.c05c1f754a33a9fbe4b2e4b284f1a5a0/?vgnextoid=868bf353d72ad510VgnVCM2000001f4a900aRCRD&vgnextchannel=374512b9ace9f310VgnVCM100000171f5a0aRCRD&vgnextfmt=default
Deportes. Centros Deportivos Municipales (Polideportivos);deporte;deportes, polideportivos, fútbol, tenis, paddle, piscina, baloncesto, gimnasio, www.madrid.es;12/03/2014;;;;continua;Dirección General de Deporte;Ayuntamiento de Madrid;https://datos.madrid.es/egob/catalogo/aviso-legal;Madrid,;csv,json,api,rdf,geo,xml,;69493;https://datos.madrid.es/portal/site/egob/menuitem.c05c1f754a33a9fbe4b2e4b284f1a5a0/?vgnextoid=4a5fbef4b2503410VgnVCM2000000c205a0aRCRD&vgnextchannel=374512b9ace9f310VgnVCM100000171f5a0aRCRD&vgnextfmt=default
Deportes. Competiciones deportivas municipales de deportes colectivos. Temporada en curso;deporte;temporada, clases deportes polideportivos, actividades deportivas, juegos deportivos;19/10/2015;19/02/2025;;;semanal;Dirección General de Deporte;Ayuntamiento de Madrid;https://datos.madrid.es/egob/catalogo/aviso-legal;Madrid,;csv,txt,;197214;https://datos.madrid.es/portal/site/egob/menuitem.c05c1f754a33a9fbe4b2e4b284f1a5a0/?vgnextoid=1d72f30d4a95b410VgnVCM2000000c205a0aRCRD&vgnextchannel=374512b9ace9f310VgnVCM100000171f5a0aRCRD&vgnextfmt=default
Deportes. Competiciones deportivas municipales de deportes colectivos. Temporadas anteriores;deporte;deportes, deporte, competiciones;19/10/2015;11/11/2024;;;anual;Dirección General de Deporte;Ayuntamiento de Madrid;https://datos.madrid.es/egob/catalogo/aviso-legal;Madrid,;csv,xls,;23541;https://datos.madrid.es/portal/site/egob/menuitem.c05c1f754a33a9fbe4b2e4b284f1a5a0/?vgnextoid=6515843eb96f5610VgnVCM2000001f4a900aRCRD&vgnextchannel=374512b9ace9f310VgnVCM100000171f5a0aRCRD&vgnextfmt=default
Deportes. Descuentos en instalaciones deportivas;deporte;polideportivo, tarifas, instalaciones deportivas, familia numerosa;02/03/2017;12/02/2025;01/01/2017;31/01/2025;mensual;Dirección General de Deporte;Ayuntamiento de Madrid;https://datos.madrid.es/egob/catalogo/aviso-legal;Madrid,;csv,json,xls,api,xml,;19080;https://datos.madrid.es/portal/site/egob/menuitem.c05c1f754a33a9fbe4b2e4b284f1a5a0/?vgnextoid=b773dae625e8a510VgnVCM1000001d4a900aRCRD&vgnextchannel=374512b9ace9f310VgnVCM100000171f5a0aRCRD&vgnextfmt=default
Deportes. Inscripción de participantes en Juegos Deportivos Municipales colectivos e individuales. Temporadas anteriores;deporte;inscripciones deportivas, participantes en juegos deportivos;28/10/2021;12/04/2024;;;anual;Dirección General de Deporte;Ayuntamiento de Madrid;https://datos.madrid.es/egob/catalogo/aviso-legal;Madrid,;csv,;2028;https://datos.madrid.es/portal/site/egob/menuitem.c05c1f754a33a9fbe4b2e4b284f1a5a0/?vgnextoid=dc54a482a46cc710VgnVCM1000001d4a900aRCRD&vgnextchannel=374512b9ace9f310VgnVCM100000171f5a0aRCRD&vgnextfmt=default
Deportes. Instalaciones Deportivas Básicas Municipales;deporte;deportes, básicas, equipamientos, canchas, fútbol, baloncesto, www.madrid.es;12/03/2014;;;;continua;Dirección General de Deporte;Ayuntamiento de Madrid;https://datos.madrid.es/egob/catalogo/aviso-legal;Madrid,;csv,json,api,rdf,geo,xml,;67009;https://datos.madrid.es/portal/site/egob/menuitem.c05c1f754a33a9fbe4b2e4b284f1a5a0/?vgnextoid=8690aed774503410VgnVCM1000000b205a0aRCRD&vgnextchannel=374512b9ace9f310VgnVCM100000171f5a0aRCRD&vgnextfmt=default
Deportes. Listas de espera de las clases de actividad dirigida en Centros Deportivos Municipales;deporte;clases deportivas, actividades deportivas, polideportivos CDM, clases en Centros Deportivos Municipales.;20/05/2024;30/12/2024;;;trimestral;Dirección General de Deporte;Ayuntamiento de Madrid;https://datos.madrid.es/egob/catalogo/aviso-legal;Madrid,;csv,xls,;1752;https://datos.madrid.es/portal/site/egob/menuitem.c05c1f754a33a9fbe4b2e4b284f1a5a0/?vgnextoid=521e319a0e08f810VgnVCM2000001f4a900aRCRD&vgnextchannel=374512b9ace9f310VgnVCM100000171f5a0aRCRD&vgnextfmt=default
Deportes. Oferta y ocupación de plazas en actividades deportivas dirigidas;deporte;clases deportivas, actividades deportivas, polideportivos CDM, clases en Centros Deportivos Municipales;01/12/2016;12/02/2025;01/01/2017;31/01/2025;mensual;Dirección General de Deporte;Ayuntamiento de Madrid;https://datos.madrid.es/egob/catalogo/aviso-legal;Madrid,;csv,xls,;26531;https://datos.madrid.es/portal/site/egob/menuitem.c05c1f754a33a9fbe4b2e4b284f1a5a0/?vgnextoid=aaa213de87ab8510VgnVCM1000001d4a900aRCRD&vgnextchannel=374512b9ace9f310VgnVCM100000171f5a0aRCRD&vgnextfmt=default
Deportes: Piscinas municipales en la ciudad de Madrid.;deporte;piscinas, piscinas públicas, www.madrid.es;25/11/2014;;;;continua;Dirección General de Deporte;Ayuntamiento de Madrid;https://datos.madrid.es/egob/catalogo/aviso-legal;Madrid,;csv,json,api,rdf,geo,xml,;32211;https://datos.madrid.es/portal/site/egob/menuitem.c05c1f754a33a9fbe4b2e4b284f1a5a0/?vgnextoid=3d481f900c6e9410VgnVCM1000000b205a0aRCRD&vgnextchannel=374512b9ace9f310VgnVCM100000171f5a0aRCRD&vgnextfmt=default
Depósitos de la grúa  del Ayuntamiento de Madrid;transporte;cultura, equipamientos, www.madrid.es;31/05/2018;;;;continua;Dirección General de Gestión y Vigilancia de la Circulación;Ayuntamiento de Madrid;https://datos.madrid.es/egob/catalogo/aviso-legal;Madrid,;csv,json,api,rdf,geo,xml,;14548;https://datos.madrid.es/portal/site/egob/menuitem.c05c1f754a33a9fbe4b2e4b284f1a5a0/?vgnextoid=408dd7c1426b3610VgnVCM1000001d4a900aRCRD&vgnextchannel=374512b9ace9f310VgnVCM100000171f5a0aRCRD&vgnextfmt=default
Deuda pública del Ayuntamiento de Madrid;economia;Endeudamiento, Préstamos, Emisiones, Operaciones de crédito;27/04/2017;17/05/2024;01/01/2004;31/12/2023;anual;Dirección General de Política Financiera;Ayuntamiento de Madrid;https://datos.madrid.es/egob/catalogo/aviso-legal;Madrid,;xls,;6061;https://datos.madrid.es/portal/site/egob/menuitem.c05c1f754a33a9fbe4b2e4b284f1a5a0/?vgnextoid=99c6400250fab510VgnVCM1000001d4a900aRCRD&vgnextchannel=374512b9ace9f310VgnVCM100000171f5a0aRCRD&vgnextfmt=default
Distinciones honoríficas otorgadas por el Ayuntamiento de Madrid;sector-publico;distinciones,honorificas;11/01/2019;26/11/2024;;26/11/2024;anual;Secretaría General del Pleno;Ayuntamiento de Madrid;https://datos.madrid.es/egob/catalogo/aviso-legal;Madrid,;csv,xls,;2072;https://datos.madrid.es/portal/site/egob/menuitem.c05c1f754a33a9fbe4b2e4b284f1a5a0/?vgnextoid=7b995e4a111c7610VgnVCM1000001d4a900aRCRD&vgnextchannel=374512b9ace9f310VgnVCM100000171f5a0aRCRD&vgnextfmt=default
