




		
		Nombre;Sector;Palabras clave:;Fecha de incorporación al catálogo:;Fecha de actualización:;Fecha de obtención de datos desde:;Fecha de obtención de datos hasta:;Frecuencia de actualización:;Responsable del conjunto de datos:;Editor:;Licencia:;Lugar:;Formatos;Descargas;URL
Ortofoto actualizada;urbanismo-infraestructuras;Ortofotografía, vuelo, ortomosaicado, ortoproyección, modelo digital;12/02/2025;;;;sindefinir;A.G. Urbanismo, Medio Ambiente y Movilidad;Ayuntamiento de Madrid;https://datos.madrid.es/egob/catalogo/aviso-legal;Madrid,;wms,;8;https://datos.madrid.es/portal/site/egob/menuitem.c05c1f754a33a9fbe4b2e4b284f1a5a0/?vgnextoid=a9f7ba8b399f4910VgnVCM2000001f4a900aRCRD&vgnextchannel=374512b9ace9f310VgnVCM100000171f5a0aRCRD&vgnextfmt=default
Archivos. Cuadro de clasificación;sector-publico;archivos, cuadro de clasificación, gestión documental;06/02/2025;10/02/2025;;06/02/2025;sindefinir;Dirección General de Bibliotecas, Archivos y Museos;Ayuntamiento de Madrid;https://datos.madrid.es/egob/catalogo/aviso-legal;Madrid,;;6;https://datos.madrid.es/portal/site/egob/menuitem.c05c1f754a33a9fbe4b2e4b284f1a5a0/?vgnextoid=14b8f33afeee4910VgnVCM2000001f4a900aRCRD&vgnextchannel=374512b9ace9f310VgnVCM100000171f5a0aRCRD&vgnextfmt=default
Callejero oficial. Viales vigentes;urbanismo-infraestructuras;Nombres geograficos, Callejero, viales;11/02/2025;;;;diaria;A.G. Urbanismo, Medio Ambiente y Movilidad;Ayuntamiento de Madrid;https://datos.madrid.es/egob/catalogo/aviso-legal;Madrid,;wms,;9;https://datos.madrid.es/portal/site/egob/menuitem.c05c1f754a33a9fbe4b2e4b284f1a5a0/?vgnextoid=59b7ec8124404910VgnVCM2000001f4a900aRCRD&vgnextchannel=374512b9ace9f310VgnVCM100000171f5a0aRCRD&vgnextfmt=default
Callejero oficial. Subviales vigentes;urbanismo-infraestructuras;Nombres geograficos, Callejero, subviales;11/02/2025;;;;diaria;A.G. Urbanismo, Medio Ambiente y Movilidad;Ayuntamiento de Madrid;https://datos.madrid.es/egob/catalogo/aviso-legal;Madrid,;wms,;6;https://datos.madrid.es/portal/site/egob/menuitem.c05c1f754a33a9fbe4b2e4b284f1a5a0/?vgnextoid=4082ec8124404910VgnVCM2000001f4a900aRCRD&vgnextchannel=374512b9ace9f310VgnVCM100000171f5a0aRCRD&vgnextfmt=default
Callejero oficial. Rotulación del callejero municipal;urbanismo-infraestructuras;Nombres geograficos, Callejero, rotulacion;11/02/2025;;;;diaria;A.G. Urbanismo, Medio Ambiente y Movilidad;Ayuntamiento de Madrid;https://datos.madrid.es/egob/catalogo/aviso-legal;Madrid,;shp,wms,;5;https://datos.madrid.es/portal/site/egob/menuitem.c05c1f754a33a9fbe4b2e4b284f1a5a0/?vgnextoid=85c14152f6204910VgnVCM1000001d4a900aRCRD&vgnextchannel=374512b9ace9f310VgnVCM100000171f5a0aRCRD&vgnextfmt=default
Callejero oficial. Geometrías de rotulación de callejero (viales y toponimia);urbanismo-infraestructuras;Nombres geograficos, Callejero;11/02/2025;;;;diaria;A.G. Urbanismo, Medio Ambiente y Movilidad;Ayuntamiento de Madrid;https://datos.madrid.es/egob/catalogo/aviso-legal;Madrid,;shp,;0;https://datos.madrid.es/portal/site/egob/menuitem.c05c1f754a33a9fbe4b2e4b284f1a5a0/?vgnextoid=4d7a4152f6204910VgnVCM1000001d4a900aRCRD&vgnextchannel=374512b9ace9f310VgnVCM100000171f5a0aRCRD&vgnextfmt=default
Modelo digital de superficies (MDS) 2019;urbanismo-infraestructuras;cartografia, Elevaciones, MDS;11/02/2025;;;;sindefinir;A.G. Urbanismo, Medio Ambiente y Movilidad;Ayuntamiento de Madrid;https://datos.madrid.es/egob/catalogo/aviso-legal;Madrid,;shp,kml,;6;https://datos.madrid.es/portal/site/egob/menuitem.c05c1f754a33a9fbe4b2e4b284f1a5a0/?vgnextoid=85d1c51571204910VgnVCM2000001f4a900aRCRD&vgnextchannel=374512b9ace9f310VgnVCM100000171f5a0aRCRD&vgnextfmt=default
Servicio de mapas del modelo digital del terreno (MDT) 2019;urbanismo-infraestructuras;Cubierta terrestre, elevaciones, mapas;11/02/2025;;;;diaria;A.G. Urbanismo, Medio Ambiente y Movilidad;Ayuntamiento de Madrid;https://datos.madrid.es/egob/catalogo/aviso-legal;Madrid,;wms,;7;https://datos.madrid.es/portal/site/egob/menuitem.c05c1f754a33a9fbe4b2e4b284f1a5a0/?vgnextoid=15cbc51571204910VgnVCM2000001f4a900aRCRD&vgnextchannel=374512b9ace9f310VgnVCM100000171f5a0aRCRD&vgnextfmt=default
Evaluación de las Unidades Distritales de Colaboración (UDC);sector-publico;Unidades Distritales de Colaboración, evaluación, ciudadanía, actuaciones, estudio;19/12/2024;18/12/2024;;;anual;Dirección General de Coordinación Territorial y Desconcentración;Ayuntamiento de Madrid;https://datos.madrid.es/egob/catalogo/aviso-legal;Madrid,;xls,;154;https://datos.madrid.es/portal/site/egob/menuitem.c05c1f754a33a9fbe4b2e4b284f1a5a0/?vgnextoid=00d6ae51504d3910VgnVCM2000001f4a900aRCRD&vgnextchannel=374512b9ace9f310VgnVCM100000171f5a0aRCRD&vgnextfmt=default
Estudio de satisfacción de las personas usuarias de las visitas guiadas por Madrid;cultura-ocio;servicios públicos, sondeos, encuestas, cultura;10/12/2024;10/12/2024;;31/12/2023;anual;Dirección de Turismo de la Empresa Madrid Destino;Ayuntamiento de Madrid;https://datos.madrid.es/egob/catalogo/aviso-legal;Madrid,;csv,xls,;61;https://datos.madrid.es/portal/site/egob/menuitem.c05c1f754a33a9fbe4b2e4b284f1a5a0/?vgnextoid=5ac163238a0b3910VgnVCM1000001d4a900aRCRD&vgnextchannel=374512b9ace9f310VgnVCM100000171f5a0aRCRD&vgnextfmt=default
Encuesta de uso del Portal de Datos Abiertos del Ayuntamiento de Madrid;sector-publico;encuesta, datos abiertos, Madrid;04/12/2024;04/12/2024;;;sindefinir;Dirección General de Transparencia y Calidad;Ayuntamiento de Madrid;https://datos.madrid.es/egob/catalogo/aviso-legal;Madrid,;csv,xls,;915;https://datos.madrid.es/portal/site/egob/menuitem.c05c1f754a33a9fbe4b2e4b284f1a5a0/?vgnextoid=f2c0f97b8f093910VgnVCM1000001d4a900aRCRD&vgnextchannel=374512b9ace9f310VgnVCM100000171f5a0aRCRD&vgnextfmt=default
Código de buenas prácticas del Ayuntamiento de Madrid;sector-publico;;29/11/2024;10/12/2024;;30/11/2024;semestral;Dirección General de Organización, Régimen Jurídico y Calidad Regulatoria;Ayuntamiento de Madrid;https://datos.madrid.es/egob/catalogo/aviso-legal;Madrid,;;140;https://datos.madrid.es/portal/site/egob/menuitem.c05c1f754a33a9fbe4b2e4b284f1a5a0/?vgnextoid=2b2b861ead673910VgnVCM1000001d4a900aRCRD&vgnextchannel=374512b9ace9f310VgnVCM100000171f5a0aRCRD&vgnextfmt=default
Seccionado censal;urbanismo-infraestructuras;Seccionado, censal, límite, administrativo;26/11/2024;;;;continua;Dirección General de Planificación Estratégica;Ayuntamiento de Madrid;https://datos.madrid.es/egob/catalogo/aviso-legal;Madrid,;xls,json-ld,kml,;149;https://datos.madrid.es/portal/site/egob/menuitem.c05c1f754a33a9fbe4b2e4b284f1a5a0/?vgnextoid=c8aebf0a69363910VgnVCM2000001f4a900aRCRD&vgnextchannel=374512b9ace9f310VgnVCM100000171f5a0aRCRD&vgnextfmt=default
Número de carriles por calles;urbanismo-infraestructuras;Circulación, número de carriles, calles, ;22/11/2024;;;;anual;Dirección General de Planificación e Infraestructuras de Movilidad;Ayuntamiento de Madrid;https://datos.madrid.es/egob/catalogo/aviso-legal;Madrid,;shp,wms,;86;https://datos.madrid.es/portal/site/egob/menuitem.c05c1f754a33a9fbe4b2e4b284f1a5a0/?vgnextoid=908a5555de353910VgnVCM2000001f4a900aRCRD&vgnextchannel=374512b9ace9f310VgnVCM100000171f5a0aRCRD&vgnextfmt=default
Modelo tridimensional de edificaciones de la cartografía base municipal;urbanismo-infraestructuras;Cartografía actualizada, edificios, modelo 3D;22/11/2024;;;;sindefinir;Dirección General de Planificación Estratégica;Ayuntamiento de Madrid;https://datos.madrid.es/egob/catalogo/aviso-legal;Madrid,;shp,;20;https://datos.madrid.es/portal/site/egob/menuitem.c05c1f754a33a9fbe4b2e4b284f1a5a0/?vgnextoid=4c04b05c49353910VgnVCM1000001d4a900aRCRD&vgnextchannel=374512b9ace9f310VgnVCM100000171f5a0aRCRD&vgnextfmt=default
Imagen de satélite actualizada;urbanismo-infraestructuras;Cubierta terrestre, satélite, ortoimagen, imagen actualizada;22/11/2024;;;;sindefinir;Dirección General de Planificación Estratégica;Ayuntamiento de Madrid;https://datos.madrid.es/egob/catalogo/aviso-legal;Madrid,;wms,;83;https://datos.madrid.es/portal/site/egob/menuitem.c05c1f754a33a9fbe4b2e4b284f1a5a0/?vgnextoid=fe7db05c49353910VgnVCM1000001d4a900aRCRD&vgnextchannel=374512b9ace9f310VgnVCM100000171f5a0aRCRD&vgnextfmt=default
Cuencas vertientes a cada estación regeneradora de aguas residuales (ERAR);medio-ambiente;Cuencas, vertientes, ERAR, Áreas, Sistemas, Depuradoras, Estaciones Regeneradoras, ríos, arroyos;22/11/2024;;;;sindefinir;Dirección General de Gestión del Agua y Zonas Verdes;Ayuntamiento de Madrid;https://datos.madrid.es/egob/catalogo/aviso-legal;Madrid,;shp,wms,;99;https://datos.madrid.es/portal/site/egob/menuitem.c05c1f754a33a9fbe4b2e4b284f1a5a0/?vgnextoid=170710a93bf43910VgnVCM2000001f4a900aRCRD&vgnextchannel=374512b9ace9f310VgnVCM100000171f5a0aRCRD&vgnextfmt=default
Cartografía actualizada. Manzanero.;urbanismo-infraestructuras;Cubierta terrestre, manzanero, cartografía actualizada, parcelas, manzanas, cartobase;22/11/2024;;;;sindefinir;Dirección General de Planificación Estratégica;Ayuntamiento de Madrid;https://datos.madrid.es/egob/catalogo/aviso-legal;Madrid,;shp,wms,;71;https://datos.madrid.es/portal/site/egob/menuitem.c05c1f754a33a9fbe4b2e4b284f1a5a0/?vgnextoid=d66094c548443910VgnVCM2000001f4a900aRCRD&vgnextchannel=374512b9ace9f310VgnVCM100000171f5a0aRCRD&vgnextfmt=default
Bien de interés cultural/patrimonial (BIC/BIP);urbanismo-infraestructuras;Uso del suelo, bien cultural, bien patrimonial;22/11/2024;;;;sindefinir;Dirección General de Patrimonio Cultural y Paisaje Urbano;Ayuntamiento de Madrid;https://datos.madrid.es/egob/catalogo/aviso-legal;Madrid,;shp,wms,;90;https://datos.madrid.es/portal/site/egob/menuitem.c05c1f754a33a9fbe4b2e4b284f1a5a0/?vgnextoid=b836fc6a6f343910VgnVCM1000001d4a900aRCRD&vgnextchannel=374512b9ace9f310VgnVCM100000171f5a0aRCRD&vgnextfmt=default
Anemómetros externos en vía pública de fuentes y túneles;medio-ambiente;Fuentes, túnel, anemómetro, viento, aire;22/11/2024;;;;diaria;A.G. Obras y Equipamiento;Ayuntamiento de Madrid;https://datos.madrid.es/egob/catalogo/aviso-legal;Madrid,;shp,wms,;136;https://datos.madrid.es/portal/site/egob/menuitem.c05c1f754a33a9fbe4b2e4b284f1a5a0/?vgnextoid=7e1100ab35343910VgnVCM1000001d4a900aRCRD&vgnextchannel=374512b9ace9f310VgnVCM100000171f5a0aRCRD&vgnextfmt=default
Ancho medio de viario;urbanismo-infraestructuras;Cubierta terrestre, viario, ancho medio, indicador;22/11/2024;;;;mensual;Dirección General de Planificación Estratégica;Ayuntamiento de Madrid;https://datos.madrid.es/egob/catalogo/aviso-legal;Madrid,;wms,;128;https://datos.madrid.es/portal/site/egob/menuitem.c05c1f754a33a9fbe4b2e4b284f1a5a0/?vgnextoid=2d5e00ab35343910VgnVCM1000001d4a900aRCRD&vgnextchannel=374512b9ace9f310VgnVCM100000171f5a0aRCRD&vgnextfmt=default
Estudio de percepción de la ciudad de Madrid por parte de las personas mayores 2024;sociedad-bienestar;estudio, percepción, Madrid, mayores, ciudades amigables;23/10/2024;24/10/2024;;;sindefinir;Dirección General de Mayores y Prevención de la Soledad no Deseada;Ayuntamiento de Madrid;https://datos.madrid.es/egob/catalogo/aviso-legal;Madrid,;xls,;244;https://datos.madrid.es/portal/site/egob/menuitem.c05c1f754a33a9fbe4b2e4b284f1a5a0/?vgnextoid=a27eb600a4a92910VgnVCM2000001f4a900aRCRD&vgnextchannel=374512b9ace9f310VgnVCM100000171f5a0aRCRD&vgnextfmt=default
Encuesta de satisfacción realizada entre las personas que utilizan los servicios analíticos del Laboratorio Municipal de Salud Pública 2023;salud;alimentos, aguas, estupefacientes, ensayos acreditados, seguridad alimentaria;05/11/2024;17/10/2024;;;anual;Madrid Salud;Ayuntamiento de Madrid;https://datos.madrid.es/egob/catalogo/aviso-legal;Madrid,;csv,xls,;301;https://datos.madrid.es/portal/site/egob/menuitem.c05c1f754a33a9fbe4b2e4b284f1a5a0/?vgnextoid=59217dc5a1a92910VgnVCM2000001f4a900aRCRD&vgnextchannel=374512b9ace9f310VgnVCM100000171f5a0aRCRD&vgnextfmt=default
Encuesta de satisfacción de las personas usuarias de la Red de Escuelas de Música y Danza;sociedad-bienestar;calidad, profesorado, dotación, escuelas, estructura, enseñanza, música, danza, escuelas municipales;30/09/2024;13/09/2024;;;anual;Dirección General de Educación, Juventud y Voluntariado;Ayuntamiento de Madrid;https://datos.madrid.es/egob/catalogo/aviso-legal;Madrid,;xls,;81;https://datos.madrid.es/portal/site/egob/menuitem.c05c1f754a33a9fbe4b2e4b284f1a5a0/?vgnextoid=59a756d3a6ae1910VgnVCM1000001d4a900aRCRD&vgnextchannel=374512b9ace9f310VgnVCM100000171f5a0aRCRD&vgnextfmt=default
Miembros y colaboradores de la comunidad The Participatory Group;sociedad-bienestar;participación ciudadana, innovación, buenas prácticas, procesos participativos;13/09/2024;15/01/2025;01/01/2024;14/01/2025;semestral;Dirección General de Participación Ciudadana;Ayuntamiento de Madrid;https://datos.madrid.es/egob/catalogo/aviso-legal;Madrid,;csv,;428;https://datos.madrid.es/portal/site/egob/menuitem.c05c1f754a33a9fbe4b2e4b284f1a5a0/?vgnextoid=5c242110246d1910VgnVCM2000001f4a900aRCRD&vgnextchannel=374512b9ace9f310VgnVCM100000171f5a0aRCRD&vgnextfmt=default
Estudio de satisfacción de personas usuarias de los Puntos de Encuentro Familiar (PEF);sociedad-bienestar;encuesta, satisfacción, puntos de encuentro familiar, PEF;20/09/2024;07/08/2024;;;anual;Dirección General de Familia e Infancia;Ayuntamiento de Madrid;https://datos.madrid.es/egob/catalogo/aviso-legal;Madrid,;xls,;119;https://datos.madrid.es/portal/site/egob/menuitem.c05c1f754a33a9fbe4b2e4b284f1a5a0/?vgnextoid=9b59f21c70d21910VgnVCM2000001f4a900aRCRD&vgnextchannel=374512b9ace9f310VgnVCM100000171f5a0aRCRD&vgnextfmt=default
Estudio de satisfacción de las personas usuarias del Archivo de Villa;sociedad-bienestar;archivo, calidad, cultura, encuesta, Madrid, patrimonio, satisfacción, servicios, usuarias, villa;11/10/2024;14/10/2024;;;anual;Dirección General de Bibliotecas, Archivos y Museos;Ayuntamiento de Madrid;https://datos.madrid.es/egob/catalogo/aviso-legal;Madrid,;csv,xls,;157;https://datos.madrid.es/portal/site/egob/menuitem.c05c1f754a33a9fbe4b2e4b284f1a5a0/?vgnextoid=af09f21c70d21910VgnVCM2000001f4a900aRCRD&vgnextchannel=374512b9ace9f310VgnVCM100000171f5a0aRCRD&vgnextfmt=default
Ofertas de Empleo Público del Ayuntamiento de Madrid y sus organismos autónomos;empleo;oferta empleo público, oep, oposiciones, funcionario, trabajo, administración, selección;05/08/2024;20/12/2024;01/01/2018;18/12/2024;anual;Dirección General de Planificación de Recursos Humanos;Ayuntamiento de Madrid;https://datos.madrid.es/egob/catalogo/aviso-legal;Madrid,;csv,json,xls,xml,;308;https://datos.madrid.es/portal/site/egob/menuitem.c05c1f754a33a9fbe4b2e4b284f1a5a0/?vgnextoid=5e79f2c137221910VgnVCM1000001d4a900aRCRD&vgnextchannel=374512b9ace9f310VgnVCM100000171f5a0aRCRD&vgnextfmt=default
Evaluación del Plan de Formación del Ayuntamiento de Madrid;empleo;evaluación, formación, Escuela Madrid Talento;10/06/2024;26/08/2024;;31/05/2024;anual;Escuela Madrid Talento;Ayuntamiento de Madrid;https://datos.madrid.es/egob/catalogo/aviso-legal;Madrid,;csv,xls,;204;https://datos.madrid.es/portal/site/egob/menuitem.c05c1f754a33a9fbe4b2e4b284f1a5a0/?vgnextoid=114d3a4959100910VgnVCM1000001d4a900aRCRD&vgnextchannel=374512b9ace9f310VgnVCM100000171f5a0aRCRD&vgnextfmt=default
Ejecución del plan de formación del Ayuntamiento de Madrid;empleo;ejecución, formación, Escuela Madrid Talento;10/06/2024;12/12/2024;;31/08/2024;trimestral;Escuela Madrid Talento;Ayuntamiento de Madrid;https://datos.madrid.es/egob/catalogo/aviso-legal;Madrid,;csv,xls,;182;https://datos.madrid.es/portal/site/egob/menuitem.c05c1f754a33a9fbe4b2e4b284f1a5a0/?vgnextoid=a8e1838311100910VgnVCM2000001f4a900aRCRD&vgnextchannel=374512b9ace9f310VgnVCM100000171f5a0aRCRD&vgnextfmt=default
Viviendas de uso turístico con licencia;vivienda;viviendas turísticas, geoportal, licencia;11/06/2024;;;;sindefinir;Agencia de Actividades;Ayuntamiento de Madrid;https://datos.madrid.es/egob/catalogo/aviso-legal;Madrid,;csv,shp,;327;https://datos.madrid.es/portal/site/egob/menuitem.c05c1f754a33a9fbe4b2e4b284f1a5a0/?vgnextoid=c012f82facdcf810VgnVCM2000001f4a900aRCRD&vgnextchannel=374512b9ace9f310VgnVCM100000171f5a0aRCRD&vgnextfmt=default
Proyecto de investigación de acompañamiento social;sociedad-bienestar;Investigación de Inclusión Social, Investigación en colaboración con el Ministerio de Inclusión social, Familias Vulnerables con menores a cargo.;22/05/2024;24/05/2024;;;informacionhistorica;Dirección General de Servicios Sociales y Atención a la Discapacidad;Ayuntamiento de Madrid;https://datos.madrid.es/egob/catalogo/aviso-legal;Madrid,;csv,xls,;439;https://datos.madrid.es/portal/site/egob/menuitem.c05c1f754a33a9fbe4b2e4b284f1a5a0/?vgnextoid=7dbf4892cc59f810VgnVCM1000001d4a900aRCRD&vgnextchannel=374512b9ace9f310VgnVCM100000171f5a0aRCRD&vgnextfmt=default
Plantilla municipal: procesos selectivos de estabilización;sector-publico;procesos de estabilización, empleo público, procesos selectivos;12/06/2024;02/01/2025;;01/01/2025;mensual;Dirección General de Planificación de Recursos Humanos;Ayuntamiento de Madrid;https://datos.madrid.es/egob/catalogo/aviso-legal;Madrid,;csv,json,xls,xml,;330;https://datos.madrid.es/portal/site/egob/menuitem.c05c1f754a33a9fbe4b2e4b284f1a5a0/?vgnextoid=814c16a1cb59f810VgnVCM2000001f4a900aRCRD&vgnextchannel=374512b9ace9f310VgnVCM100000171f5a0aRCRD&vgnextfmt=default
Mentoring;empleo;mentoring, mentores, mentorizados, mentees;30/07/2024;06/02/2025;;;semestral;Dirección General de Planificación de Recursos Humanos;Ayuntamiento de Madrid;https://datos.madrid.es/egob/catalogo/aviso-legal;Madrid,;csv,json,xls,xml,;459;https://datos.madrid.es/portal/site/egob/menuitem.c05c1f754a33a9fbe4b2e4b284f1a5a0/?vgnextoid=607c30eef868f810VgnVCM2000001f4a900aRCRD&vgnextchannel=374512b9ace9f310VgnVCM100000171f5a0aRCRD&vgnextfmt=default
Estudio de satisfacción de las personas usuarias de los museos y exposiciones municipales;cultura-ocio;servicios públicos, sondeos, encuestas, cultura;17/05/2024;23/05/2024;;31/12/2023;anual;Dirección General de Bibliotecas, Archivos y Museos;Ayuntamiento de Madrid;https://datos.madrid.es/egob/catalogo/aviso-legal;Madrid,;csv,xls,;435;https://datos.madrid.es/portal/site/egob/menuitem.c05c1f754a33a9fbe4b2e4b284f1a5a0/?vgnextoid=e43a85f3be58f810VgnVCM2000001f4a900aRCRD&vgnextchannel=374512b9ace9f310VgnVCM100000171f5a0aRCRD&vgnextfmt=default
Madrid Salud. Personas en tratamiento en los centros de atención a las adicciones (CAD);salud;tratamiento, adicciones, distritos, CAD, centros, reingresos;29/04/2024;28/08/2024;;30/06/2024;anual;Madrid Salud;Ayuntamiento de Madrid;https://datos.madrid.es/egob/catalogo/aviso-legal;Madrid,;csv,xls,;3467;https://datos.madrid.es/portal/site/egob/menuitem.c05c1f754a33a9fbe4b2e4b284f1a5a0/?vgnextoid=31754898f592f810VgnVCM2000001f4a900aRCRD&vgnextchannel=374512b9ace9f310VgnVCM100000171f5a0aRCRD&vgnextfmt=default
Problemáticas sociales identificadas en Centros de Servicios Sociales Atención Social Primaria;sociedad-bienestar;;15/07/2024;19/02/2025;;;diaria;Dirección General de Servicios Sociales y Atención a la Discapacidad;Ayuntamiento de Madrid;https://datos.madrid.es/egob/catalogo/aviso-legal;Madrid,;csv,json,api,xml,;1904;https://datos.madrid.es/portal/site/egob/menuitem.c05c1f754a33a9fbe4b2e4b284f1a5a0/?vgnextoid=75996c6b81f0f810VgnVCM2000001f4a900aRCRD&vgnextchannel=374512b9ace9f310VgnVCM100000171f5a0aRCRD&vgnextfmt=default
Planes de formación del Centro Integral de Formación de Seguridad y Emergencias (CIFSE);seguridad;Samur, Proteccion Civil, Movilidad, Policía Municipal, Bomberos, formacion, CIFSE;07/05/2024;19/04/2024;;;anual;Coordinación General de Seguridad y Emergencias;Ayuntamiento de Madrid;https://datos.madrid.es/egob/catalogo/aviso-legal;Madrid,;csv,json,xml,;1346;https://datos.madrid.es/portal/site/egob/menuitem.c05c1f754a33a9fbe4b2e4b284f1a5a0/?vgnextoid=6fdfb9a5742fe810VgnVCM2000001f4a900aRCRD&vgnextchannel=374512b9ace9f310VgnVCM100000171f5a0aRCRD&vgnextfmt=default
Estudio de Satisfacción con el Programa de Escuelas Municipales de Promoción Deportiva en centros escolares;deporte;escuelas, deporte escolar, promoción;11/04/2024;15/04/2024;;;anual;Dirección General de Deporte;Ayuntamiento de Madrid;https://datos.madrid.es/egob/catalogo/aviso-legal;Madrid,;xls,;252;https://datos.madrid.es/portal/site/egob/menuitem.c05c1f754a33a9fbe4b2e4b284f1a5a0/?vgnextoid=23c3cd56a4cce810VgnVCM1000001d4a900aRCRD&vgnextchannel=374512b9ace9f310VgnVCM100000171f5a0aRCRD&vgnextfmt=default
Parque Tecnológico de Valdemingómez (PTV): biogás y biometano generado a partir de los residuos;medio-ambiente;Residuos, reciclaje, Valdemingómez, tratamiento, gestión residuos, biogás, biometano, Biometanización las Dehesas, Biometanización la Paloma, Planta de Tratamiento de Biogás.;12/03/2024;07/02/2025;;31/12/2024;semestral;Dirección General del Parque Tecnológico de Valdemingómez;Ayuntamiento de Madrid;https://datos.madrid.es/egob/catalogo/aviso-legal;Madrid,;csv,xls,;424;https://datos.madrid.es/portal/site/egob/menuitem.c05c1f754a33a9fbe4b2e4b284f1a5a0/?vgnextoid=ad54d4b93923e810VgnVCM1000001d4a900aRCRD&vgnextchannel=374512b9ace9f310VgnVCM100000171f5a0aRCRD&vgnextfmt=default
Parque Tecnológico de Valdemingómez (PTV): energía eléctrica generada a partir de los residuos;medio-ambiente;;12/03/2024;07/02/2025;;31/12/2024;trimestral;Dirección General del Parque Tecnológico de Valdemingómez;Ayuntamiento de Madrid;https://datos.madrid.es/egob/catalogo/aviso-legal;Madrid,;csv,xls,;410;https://datos.madrid.es/portal/site/egob/menuitem.c05c1f754a33a9fbe4b2e4b284f1a5a0/?vgnextoid=2ec957f20923e810VgnVCM2000001f4a900aRCRD&vgnextchannel=374512b9ace9f310VgnVCM100000171f5a0aRCRD&vgnextfmt=default
Parque Tecnológico de Valdemingómez (PTV): recuperación de materiales;medio-ambiente;residuos, reciclaje, Valdemingómez, tratamiento, gestión residuos, restos, plásticos, metales, briks, biorresiduos, papel-cartón, vidrio, compost, bioestabilizado;12/03/2024;07/02/2025;;31/12/2024;trimestral;Dirección General del Parque Tecnológico de Valdemingómez;Ayuntamiento de Madrid;https://datos.madrid.es/egob/catalogo/aviso-legal;Madrid,;csv,xls,;628;https://datos.madrid.es/portal/site/egob/menuitem.c05c1f754a33a9fbe4b2e4b284f1a5a0/?vgnextoid=926300d72623e810VgnVCM2000001f4a900aRCRD&vgnextchannel=374512b9ace9f310VgnVCM100000171f5a0aRCRD&vgnextfmt=default
Parque Tecnológico de Valdemingómez (PTV): entradas de residuos;medio-ambiente;residuos, reciclaje, Valdemingómez, tratamiento, gestión residuos, restos, plásticos, metales, briks, biorresiduos, poda, vidrio, compost, voluminosos, vertido directo, Las Dehesas, La Paloma, Las Lomas, planta de Biometanización de las Dehesas, particulares, zonas verdes, limpieza espacios públicos, parques y jardines, recogida domiciliaria, actividades económicas, ciudadanos, distritos ciudad Madrid;12/03/2024;10/02/2025;;31/12/2024;bimestral;Dirección General del Parque Tecnológico de Valdemingómez;Ayuntamiento de Madrid;https://datos.madrid.es/egob/catalogo/aviso-legal;Madrid,;csv,xls,;502;https://datos.madrid.es/portal/site/egob/menuitem.c05c1f754a33a9fbe4b2e4b284f1a5a0/?vgnextoid=7688255b2a13e810VgnVCM2000001f4a900aRCRD&vgnextchannel=374512b9ace9f310VgnVCM100000171f5a0aRCRD&vgnextfmt=default
Encuesta de satisfacción de la ciudadanía con el servicio de información de calidad del aire y contaminación atmosférica a través del sitio https://airedemadrid.madrid.es;medio-ambiente;calidad, aire, contaminación, salud, airedemadrid, portal, encuesta, satisfacción;14/03/2024;11/03/2024;01/01/2023;31/12/2023;sindefinir;Dirección General de Sostenibilidad y Control Ambiental;Ayuntamiento de Madrid;https://datos.madrid.es/egob/catalogo/aviso-legal;Madrid,;xls,;182;https://datos.madrid.es/portal/site/egob/menuitem.c05c1f754a33a9fbe4b2e4b284f1a5a0/?vgnextoid=8d3ae2b0b4d2e810VgnVCM2000001f4a900aRCRD&vgnextchannel=374512b9ace9f310VgnVCM100000171f5a0aRCRD&vgnextfmt=default
Estudio de Satisfacción de las personas usuarias del Servicio de los Agentes de Movilidad 2023;medio-ambiente;estudios, encuestas, agentes movilidad;11/03/2024;12/03/2024;01/01/2023;31/12/2023;sindefinir;Dirección General de Gestión y Vigilancia de la Circulación;Ayuntamiento de Madrid;https://datos.madrid.es/egob/catalogo/aviso-legal;Madrid,;csv,xls,;445;https://datos.madrid.es/portal/site/egob/menuitem.c05c1f754a33a9fbe4b2e4b284f1a5a0/?vgnextoid=4d4e4ac6d60dd810VgnVCM2000001f4a900aRCRD&vgnextchannel=374512b9ace9f310VgnVCM100000171f5a0aRCRD&vgnextfmt=default
Estudio de satisfacción de las personas usuarias de los Apartamentos  Municipales para Mayores;sociedad-bienestar;sondeos encuestas, apartamentos, mayores;04/03/2024;02/02/2024;;;sindefinir;Dirección General de Mayores y Prevención de la Soledad No Deseada;Ayuntamiento de Madrid;https://datos.madrid.es/egob/catalogo/aviso-legal;Madrid,;xls,;379;https://datos.madrid.es/portal/site/egob/menuitem.c05c1f754a33a9fbe4b2e4b284f1a5a0/?vgnextoid=154a04c14396d810VgnVCM2000001f4a900aRCRD&vgnextchannel=374512b9ace9f310VgnVCM100000171f5a0aRCRD&vgnextfmt=default
Piscinas de comunidades de vecinos;economia;piscinas comunidades ;22/01/2024;18/01/2024;18/01/2024;18/01/2024;anual;Dirección General de Contratación y Servicios - Subdirección General de Estadística;Ayuntamiento de Madrid;https://datos.madrid.es/egob/catalogo/aviso-legal;Madrid,;csv,xls,;494;https://datos.madrid.es/portal/site/egob/menuitem.c05c1f754a33a9fbe4b2e4b284f1a5a0/?vgnextoid=ea9a2618683fc810VgnVCM1000001d4a900aRCRD&vgnextchannel=374512b9ace9f310VgnVCM100000171f5a0aRCRD&vgnextfmt=default
